{
  "schema": "asb.connections/2",
  "datasetVersion": "2026.09.1",
  "rankingVersion": "asb.rank.v2",
  "translation": "bsb",
  "vid": 23053005,
  "ref": "Isa.53.5",
  "label": "Isaiah 53:5",
  "counts": {
    "out": 19,
    "in": 69,
    "inDirect": 16,
    "inViaRange": 53,
    "unique": 79
  },
  "items": [
    {
      "rank": 1,
      "to": {
        "start": 60002024,
        "end": 60002025,
        "ref": "1Pet.2.24-1Pet.2.25",
        "label": "1 Peter 2:24–25"
      },
      "direction": "both",
      "votesOut": 15,
      "votesIn": 11,
      "score": 18.18,
      "weight": 1.0,
      "tier": "strong",
      "sameBook": false,
      "viaRange": {
        "start": 23053004,
        "end": 23053006,
        "label": "Isaiah 53:4–6",
        "span": 3
      },
      "snippet": "He Himself bore our sins in His body on the tree, so that we might die to sin and live to righteousness. “By…",
      "alsoCites": []
    },
    {
      "rank": 2,
      "to": {
        "start": 60003018,
        "end": 60003018,
        "ref": "1Pet.3.18",
        "label": "1 Peter 3:18"
      },
      "direction": "both",
      "votesOut": 14,
      "votesIn": 2,
      "score": 14.58,
      "weight": 0.93,
      "tier": "strong",
      "sameBook": false,
      "viaRange": {
        "start": 23053004,
        "end": 23053006,
        "label": "Isaiah 53:4–6",
        "span": 3
      },
      "snippet": "For Christ also suffered for sins once for all, the righteous for the unrighteous, to bring you to God. He…",
      "alsoCites": []
    },
    {
      "rank": 3,
      "to": {
        "start": 40020028,
        "end": 40020028,
        "ref": "Matt.20.28",
        "label": "Matthew 20:28"
      },
      "direction": "both",
      "votesOut": 11,
      "votesIn": 4,
      "score": 13.0,
      "weight": 0.893,
      "tier": "strong",
      "sameBook": false,
      "viaRange": null,
      "snippet": "just as the Son of Man did not come to be served, but to serve, and to give His life as a ransom for many.”",
      "alsoCites": []
    },
    {
      "rank": 4,
      "to": {
        "start": 45004025,
        "end": 45004025,
        "ref": "Rom.4.25",
        "label": "Romans 4:25"
      },
      "direction": "both",
      "votesOut": 11,
      "votesIn": 4,
      "score": 12.41,
      "weight": 0.879,
      "tier": "strong",
      "sameBook": false,
      "viaRange": {
        "start": 23053005,
        "end": 23053006,
        "label": "Isaiah 53:5–6",
        "span": 2
      },
      "snippet": "He was delivered over to death for our trespasses and was raised to life for our justification.",
      "alsoCites": []
    },
    {
      "rank": 5,
      "to": {
        "start": 45005006,
        "end": 45005010,
        "ref": "Rom.5.6-Rom.5.10",
        "label": "Romans 5:6–10"
      },
      "direction": "out",
      "votesOut": 12,
      "votesIn": 0,
      "score": 12.0,
      "weight": 0.868,
      "tier": "strong",
      "sameBook": false,
      "viaRange": null,
      "snippet": "For at just the right time, while we were still powerless, Christ died for the ungodly.",
      "alsoCites": []
    },
    {
      "rank": 6,
      "to": {
        "start": 47005021,
        "end": 47005021,
        "ref": "2Cor.5.21",
        "label": "2 Corinthians 5:21"
      },
      "direction": "both",
      "votesOut": 8,
      "votesIn": 8,
      "score": 10.31,
      "weight": 0.821,
      "tier": "strong",
      "sameBook": false,
      "viaRange": {
        "start": 23053004,
        "end": 23053006,
        "label": "Isaiah 53:4–6",
        "span": 3
      },
      "snippet": "God made Him who knew no sin to be sin on our behalf, so that in Him we might become the righteousness of God.",
      "alsoCites": []
    },
    {
      "rank": 7,
      "to": {
        "start": 46015003,
        "end": 46015003,
        "ref": "1Cor.15.3",
        "label": "1 Corinthians 15:3"
      },
      "direction": "both",
      "votesOut": 7,
      "votesIn": 5,
      "score": 7.72,
      "weight": 0.733,
      "tier": "solid",
      "sameBook": false,
      "viaRange": {
        "start": 23053001,
        "end": 23053012,
        "label": "Isaiah 53:1–12",
        "span": 12
      },
      "snippet": "For what I received I passed on to you as of first importance: that Christ died for our sins according to the…",
      "alsoCites": []
    },
    {
      "rank": 8,
      "to": {
        "start": 58010010,
        "end": 58010010,
        "ref": "Heb.10.10",
        "label": "Hebrews 10:10"
      },
      "direction": "out",
      "votesOut": 6,
      "votesIn": 0,
      "score": 6.0,
      "weight": 0.659,
      "tier": "solid",
      "sameBook": false,
      "viaRange": null,
      "snippet": "And by that will, we have been sanctified through the sacrifice of the body of Jesus Christ once for all.",
      "alsoCites": []
    },
    {
      "rank": 9,
      "to": {
        "start": 23053006,
        "end": 23053008,
        "ref": "Isa.53.6-Isa.53.8",
        "label": "Isaiah 53:6–8"
      },
      "direction": "out",
      "votesOut": 5,
      "votesIn": 0,
      "score": 5.0,
      "weight": 0.607,
      "tier": "solid",
      "sameBook": true,
      "viaRange": null,
      "snippet": "We all like sheep have gone astray, each one has turned to his own way; and the LORD has laid upon Him the…",
      "alsoCites": []
    },
    {
      "rank": 10,
      "to": {
        "start": 49005002,
        "end": 49005002,
        "ref": "Eph.5.2",
        "label": "Ephesians 5:2"
      },
      "direction": "out",
      "votesOut": 5,
      "votesIn": 0,
      "score": 5.0,
      "weight": 0.607,
      "tier": "solid",
      "sameBook": false,
      "viaRange": null,
      "snippet": "and walk in love, just as Christ loved us and gave Himself up for us as a fragrant sacrificial offering to…",
      "alsoCites": []
    },
    {
      "rank": 11,
      "to": {
        "start": 58009012,
        "end": 58009015,
        "ref": "Heb.9.12-Heb.9.15",
        "label": "Hebrews 9:12–15"
      },
      "direction": "out",
      "votesOut": 5,
      "votesIn": 0,
      "score": 5.0,
      "weight": 0.607,
      "tier": "solid",
      "sameBook": false,
      "viaRange": null,
      "snippet": "He did not enter by the blood of goats and calves, but He entered the Most Holy Place once for all by His own…",
      "alsoCites": []
    },
    {
      "rank": 12,
      "to": {
        "start": 58010014,
        "end": 58010014,
        "ref": "Heb.10.14",
        "label": "Hebrews 10:14"
      },
      "direction": "out",
      "votesOut": 5,
      "votesIn": 0,
      "score": 5.0,
      "weight": 0.607,
      "tier": "solid",
      "sameBook": false,
      "viaRange": null,
      "snippet": "because by a single offering He has made perfect for all time those who are being sanctified.",
      "alsoCites": []
    },
    {
      "rank": 13,
      "to": {
        "start": 23053010,
        "end": 23053012,
        "ref": "Isa.53.10-Isa.53.12",
        "label": "Isaiah 53:10–12"
      },
      "direction": "both",
      "votesOut": 4,
      "votesIn": 3,
      "score": 4.75,
      "weight": 0.592,
      "tier": "solid",
      "sameBook": true,
      "viaRange": {
        "start": 23053003,
        "end": 23053006,
        "label": "Isaiah 53:3–6",
        "span": 4
      },
      "snippet": "Yet it was the LORD’s will to crush Him and to cause Him to suffer; and when His soul is made a guilt…",
      "alsoCites": []
    },
    {
      "rank": 14,
      "to": {
        "start": 58009028,
        "end": 58009028,
        "ref": "Heb.9.28",
        "label": "Hebrews 9:28"
      },
      "direction": "both",
      "votesOut": 4,
      "votesIn": 2,
      "score": 4.58,
      "weight": 0.582,
      "tier": "solid",
      "sameBook": false,
      "viaRange": {
        "start": 23053004,
        "end": 23053006,
        "label": "Isaiah 53:4–6",
        "span": 3
      },
      "snippet": "so also Christ was offered once to bear the sins of many; and He will appear a second time, not to bear sin…",
      "alsoCites": []
    },
    {
      "rank": 15,
      "to": {
        "start": 45003024,
        "end": 45003026,
        "ref": "Rom.3.24-Rom.3.26",
        "label": "Romans 3:24–26"
      },
      "direction": "out",
      "votesOut": 4,
      "votesIn": 0,
      "score": 4.0,
      "weight": 0.545,
      "tier": "solid",
      "sameBook": false,
      "viaRange": null,
      "snippet": "and are justified freely by His grace through the redemption that is in Christ Jesus.",
      "alsoCites": []
    },
    {
      "rank": 16,
      "to": {
        "start": 45005015,
        "end": 45005021,
        "ref": "Rom.5.15-Rom.5.21",
        "label": "Romans 5:15–21"
      },
      "direction": "out",
      "votesOut": 4,
      "votesIn": 0,
      "score": 4.0,
      "weight": 0.545,
      "tier": "solid",
      "sameBook": false,
      "viaRange": null,
      "snippet": "But the gift is not like the trespass. For if the many died by the trespass of the one man, how much more did…",
      "alsoCites": []
    },
    {
      "rank": 17,
      "to": {
        "start": 38013007,
        "end": 38013007,
        "ref": "Zech.13.7",
        "label": "Zechariah 13:7"
      },
      "direction": "both",
      "votesOut": 3,
      "votesIn": 3,
      "score": 3.57,
      "weight": 0.514,
      "tier": "light",
      "sameBook": false,
      "viaRange": {
        "start": 23053004,
        "end": 23053010,
        "label": "Isaiah 53:4–10",
        "span": 7
      },
      "snippet": "Awake, O sword, against My Shepherd, against the man who is My Companion, declares the LORD of Hosts. Strike…",
      "alsoCites": []
    },
    {
      "rank": 18,
      "to": {
        "start": 1003015,
        "end": 1003015,
        "ref": "Gen.3.15",
        "label": "Genesis 3:15"
      },
      "direction": "out",
      "votesOut": 3,
      "votesIn": 0,
      "score": 3.0,
      "weight": 0.469,
      "tier": "light",